{
  "title": "Wave Propagation – exercises for the learning objectives",
  "description": "Exercises for learning objectives of the learningphysics.ch app Wave Propagation that had fewer than three exercises (objectives: superpose).",
  "kind": "sheet",
  "is_private": true,
  "tags": [
    "learningphysics"
  ],
  "items": [
    {
      "exercise": "wave-propagation-07-an-upright-step-meets-an-inverted-ramp"
    }
  ]
}