{
  "title": "Kraftbegriff – Aufgaben zu den Lernzielen",
  "description": "Aufgaben für Lernziele der App Kraftbegriff von learningphysics.ch, die noch weniger als drei Aufgaben hatten (Lernziele: first).",
  "kind": "sheet",
  "is_private": true,
  "tags": [
    "learningphysics"
  ],
  "items": [
    {
      "exercise": "force-concepts-02-die-schnur-reisst"
    },
    {
      "exercise": "force-concepts-03-propeller-aus"
    }
  ]
}